<?xml version="1.0" encoding="UTF-8"?>
<personal
    xmlns:xsi="http://www.w3.org/2001/XMLSchema-instance"
    xsi:noNamespaceSchemaLocation="demo-6.xsd">
  <employee id='E1'>
    <phone mobile='false'>123-45-78</phone>
    <email>john@smith.com</email>
    <name>
      <first>John</first>
      <last>Smith</last>
      <middle>K.</middle>
    </name>
    <car>...</car>
  </employee>
  <employee id='E2'>
    <phone>123-45-78</phone>
    <email>john@smith.com</email>
    <name>
      <first>John</first>
      <last>Smith</last>
      <middle>K.</middle>
    </name>
    <pet>....</pet>
  </employee>
</personal>